name,id,tier,rarity,base value,range,damage/second,damage/shot,emp,impact,turn rate,OPs,ammo,ammo/sec,reload size,type,energy/shot,energy/second,chargeup,chargedown,burst size,burst delay,min spread,max spread,spread/shot,spread decay/sec,beam speed,proj speed,launch speed,flight time,proj hitpoints,autofireAccBonus,extraArcForAI,hints,tags,groupTag,tech/manufacturer,for weapon tooltip>>,primaryRoleStr,speedStr,trackingStr,turnRateStr,accuracyStr,customPrimary,customPrimaryHL,customAncillary,customAncillaryHL,noDPSInTooltip,number
Mitrailleuse Légère,lightmg,0,,100,300,,25,,1,50,3,,,,KINETIC,3,,0,0.4,5,0.1,0,5,1,15,,600,,,10,,,PD,"pd6, kinetic3, SR, base_bp, ind",,,,Point Defense,,,,,,,,,,0.5
Double Mitrailleuse Légère,lightdualmg,2,,400,300,,25,,1,50,5,,,,KINETIC,3,,0,0.2,5,0.1,0,5,1,15,,600,,,10,,,PD,"pd7, kinetic4, SR, lowtech_bp, merc, ind",,,,Point Defense,,,,,,,,,,0.7
Mortier Léger,lightmortar,0,,75,600,,75,,4,30,2,,,,HIGH_EXPLOSIVE,50,,0,1,1,,0,15,3,10,,500,,,10,,,,"he6, base_bp, ind",,,,Anti Armor,,,,,,,,,,0.75
#Light Mortar (High Delay),lightmortar_fighter,0,,75,400,,75,,4,30,2,,,,HIGH_EXPLOSIVE,50,,0,2,1,,0,15,3,10,,500,,,10,,,SYSTEM,"he6, show_in_codex",,,,Anti Armor (Fighter),,,,,,,,,,0.8
Canon Vulcain,vulcan,1,,200,250,,25,,1,75,4,,,,FRAGMENTATION,1,,0,0.05,1,,0,15,1,15,,800,,,10,,,PD,"pd7, SR, lowtech_bp, merc, ind",,,,Point Defense,,,,,,,,,,1
Autocanon Léger,lightac,0,,125,700,,50,,3,20,4,,,,KINETIC,40,,0,0.5,1,,0,8,2,15,,800,,,20,,,,"kinetic6, base_bp, ind",,,,Anti Shield,,,,,,,,,,2
Double Autocanon Léger,lightdualac,1,,300,600,,50,,3,20,5,,,,KINETIC,40,,0,0.6,2,0.1,0,20,3,9,,800,,,20,,,,"kinetic7, lowtech_bp, midline_bp, merc, ind",,,,Anti Shield,,,,,,,,,,2.5
Canon d'Assaut Léger,lightag,1,,300,700,,40,,3,40,5,,,,HIGH_EXPLOSIVE,40,,0,0.25,1,,0,5,1,5,,800,,,30,,,,"he6, lowtech_bp, midline_bp, merc, ind",,,,Anti Armor,,,,,,,,,,3
Mine de Proximité Classe Stinger,fragbomb,0,,100,500,,500,,10,0,1,2,0.1,,FRAGMENTATION,0,,0,1,1,,0,0,0,0,,50,20,7,150,,,"DO_NOT_AIM, ANTI_FTR, PD_ONLY, SYSTEM","he0, show_in_codex",,,,Anti Fighter (Fighter),,,,,,,,,TRUE,3.2
Soute à Bombes à Sous-munitions,clusterbomb,2,,350,1500,,300,,30,15,5,30,,,HIGH_EXPLOSIVE,0,,0,2,5,0.1,0,0,0,0,,20,20,60,75,,,"STRIKE,SYSTEM",he0,,,,Strike,,,,,,,,,TRUE,3.4
Soute à Bombes Standard,bomb,1,,200,2000,,400,,50,15,4,10,,,HIGH_EXPLOSIVE,0,,0,0.67,1,,20,20,0,0,,170,20,25,150,,,"STRIKE, BOMB","he0, no_sell, no_drop, no_drop_salvage",,,,Strike,,,,,,,,,TRUE,3.5
Aiguilleur Léger,lightneedler,3,0.3,800,700,,50,,1,20,8,,,,KINETIC,40,,0,4.3,15,0.05,0,10,0.66,5,,1200,,,10,,,,"kinetic9, LR, remnant, rare_bp, hist1t, merc, ind",,,,Anti Shield,,,,,,,,,,3.65
Railgun,railgun,2,0.5,600,700,,100,,10,30,7,,,,KINETIC,90,,0.6,0,1,,,,,,,1000,,,50,,,,"kinetic8, LR, remnant, rare_bp, hist1t, merc, ind",,,,Anti Shield,,,,,,,,,,3.75
Thumper,shredder,0,,700,700,,100,,1,25,7,60,5,20,FRAGMENTATION,25,,0,0.55,20,0.05,0,7,1,20,,800,,,30,,,,"kinetic8, base_bp, ind",,,,General,,,,,,,,,,3.8
Mitrailleuse Lourde,heavymg,2,,1200,450,,40,,3,40,10,,,,KINETIC,15,,0,0.2,4,0.1,0,5,1,15,,700,,,30,,,"PD,PD_ALSO","kinetic11, pd10, SR, midline_bp, merc, ind",,,,Point Defense,,,,,,,,,,3.85
Mortier Lourd,heavymortar,0,,600,700,,110,,12,30,7,,,,HIGH_EXPLOSIVE,90,,0,0.7,2,0.3,0,20,5,5,,500,,,30,,,,"he11, base_bp, merc, ind",,,,Anti Armor,,,,,,,,,,3.9
Canon Flak,flak,1,,1000,500,,200,,10,40,8,,,,FRAGMENTATION,50,,0,1,1,,0,10,2,10,,700,,,30,,,PD,"pd13, SR, lowtech_bp, merc, ind",,,,Point Defense (Area),,,,,,,,,,4
Autocanon Arbalète,arbalest,0,,800,700,,200,,10,12,8,,,,KINETIC,150,,0,1.2,1,,0,15,5,10,,800,,,30,,,,"kinetic12, base_bp, ind",,,,Anti Shield,,,,,,,,,,4.125
Double Canon Flak,dualflak,2,,1400,400,,150,,10,60,12,,,,FRAGMENTATION,50,,0,0.333333,1,,0,10,2,10,,700,,,30,,,PD,"pd15, SR, remnant, rare_bp, merc, ind",,,,Point Defense (Area),,,,,,,,,,4.25
Gatling d'Assaut,chaingun,1,,1000,450,,75,,3,30,10,,,,HIGH_EXPLOSIVE,60,,0,0.15,1,,0,20,1,10,,800,,,30,,,,"he15, SR, lowtech_bp, midline_bp, merc, ind",,,,Anti Armor,,,,,,,,,,4.5
Dévastateur Lourd,heavymauler,3,0.3,2000,1000,,200,,10,20,12,,,,HIGH_EXPLOSIVE,200,,0,4.4,3,0.3,0,5,1,10,,900,,,30,,,,"he16, LR, remnant, rare_bp, merc, ind",,,,Anti Armor,,,,,,,,,,4.75
Autocanon Lourd,heavyac,1,,1000,800,,100,,10,7,10,,,,KINETIC,90,,0,1,3,0.2,0,18,3,10,,800,,,30,,,,"kinetic14, lowtech_bp, merc, ind",,,,Anti Shield,,,,,,,,,,5
Propulseur Hypervéloce,hveldriver,3,0.3,2250,1000,,275,400,40,10,13,,,,KINETIC,350,,0,2,1,,,,,,,1000,,,300,,,,"kinetic15, LR, remnant, rare_bp, merc, ind",,,,Anti Shield,,,,,,,,,,5.5
Aiguilleur Lourd,heavyneedler,3,0.3,2500,700,,50,,1,15,15,,,,KINETIC,40,,0,4.55,30,0.05,1,10,0.5,5,,1200,,,10,,,,"kinetic15, remnant, rare_bp, hist1t, merc, ind",,,,Anti Shield,,,,,,,,,,5.75
Canon de Gauss,gauss,3,,5000,1200,,700,,300,3,25,,,,KINETIC,1200,,1,1,,,,,,,,1200,,,400,,,,"kinetic20, LR, remnant, rare_bp, hist1t, merc, ind",,,,Anti Shield,,,,,,,,,,6
Canon d'Assaut Héphaïstos,hephag,1,,4000,900,,120,,5,20,20,,,,HIGH_EXPLOSIVE,110,,0,0.25,1,,0,5,1,5,,800,,,50,,,,"he18, lowtech_bp, midline_bp, merc, ind",,,,Anti Armor,,,,,,,,,,7
Autocanon Mark IX,mark9,0,,3000,900,,200,,20,10,18,,,,KINETIC,200,,0,2,4,0.1,0,15,2,10,,800,,,100,,,,"kinetic18, base_bp, merc, ind",,,,Anti Shield,,,,,,,,,,7.25
Canon Dévastateur,devastator,1,,3500,900,,150,,40,12,20,,,,HIGH_EXPLOSIVE,75,,0,2,12,0.1,5,30,5,5,,700,,,100,,,"PD,PD_ALSO","he16, pd17, lowtech_bp, merc, ind",,,,Anti Fighter (Area),,,,,"Chaque obus a une fusée réglée pour exploser à une distance aléatoire, résultant en un barrage de plus en plus meurtrier à courte portée.

Ciblera les missiles si aucune autre cible n'est à portée.",,,,,7.4
Canon Mjolnir,mjolnir,2,0.4,6000,900,,400,200,10,25,24,,,,ENERGY,500,,0,0.75,1,,0,5,1,10,,900,,,75,,,,"energy18, he17, kinetic17, remnant, rare_bp, hist1t, merc, ind",,,,General,,,,,,,,,,7.5
Canon Hellbore,hellbore,0,,3000,900,,750,,200,5,16,,,,HIGH_EXPLOSIVE,750,,0,3,1,,0,10,5,10,,500,,,400,,,,"he18, lowtech_bp, merc, ind",,,,Anti Armor,,,,,,,,,,8
Aiguilleur Tempête,multineedler,3,0.4,6500,700,,50,,20,15,28,60,10,30,KINETIC,35,,0,0.05,1,,0,5,0.25,5,,1200,,,20,,,,"kinetic19, remnant, rare_bp, hist1t, merc, ind",,,,Anti Shield,,,,,,,,,,8.5
Torpille Classe Reaper,reaper,1,,200,1200,,4000,,75,10,2,1,,,HIGH_EXPLOSIVE,0,,0,5,1,,0,0,0,0,,400,100,3.5,500,,,STRIKE,"strike8, rocket3, missile_bp, merc, ind",,,,Torpedo,Fast,None,,,,,,,TRUE,9
Râtelier de Torpilles Classe Atropos,atropos,2,0.5,600,1200,,1000,,40,10,3,2,,,HIGH_EXPLOSIVE,0,,0,1,1,,0,0,0,0,,400,150,4,300,,,GUIDED_POOR,"strike9, missile1, missile_bp, merc, ind, reload_3pt",,,,Torpedo,Fast,Good,,,,,,,TRUE,9.5
Torpille Classe Atropos (Simple),atropos_single,2,0.5,300,1200,,1000,,40,10,1,1,,,HIGH_EXPLOSIVE,0,,0,1,1,,0,0,0,0,,400,150,4,300,,,GUIDED_POOR,"strike7, missile0, base_bp, ind, reload_1_and_a_half_pt",,,,Torpedo,Fast,Good,,,,,,,TRUE,9.75
Torpille Classe Hammer,hammer,0,,150,1200,,1500,,30,10,2,2,,,HIGH_EXPLOSIVE,0,,0,1,1,,0,0,0,0,,500,40,4,350,,,STRIKE,"strike6, rocket2, base_bp, ind",,,,Torpedo,Fast,None,,,,,,,TRUE,9.8
Torpille Classe Hammer (Simple),hammer_single,0,,75,1200,,1500,,30,10,1,1,,,HIGH_EXPLOSIVE,0,,0,1,1,,0,0,0,0,,500,40,4,350,,,STRIKE,"strike5, rocket1, base_bp, ind",,,,Torpedo,Fast,None,,,,,,,TRUE,9.9
Lance-SRM Essaim,swarmer,1,,250,1000,,100,,15,50,3,80,,,HIGH_EXPLOSIVE,0,,0,5,4,0.2,0,0,0,0,,300,100,5,50,,,"ANTI_FTR, DO_NOT_AIM, DO_NOT_CONSERVE","utility8, missile0, missile_bp, merc, ind",,,,Anti Small Craft,Fast,Excellent,,,,,,,,10
Lance-SRM Essaim,swarmer_fighter,1,,250,1000,,100,,5,50,4,2,0.075,,HIGH_EXPLOSIVE,0,,0,5,2,0.2,0,0,0,0,,300,100,5,50,,,"ANTI_FTR, DO_NOT_AIM, SYSTEM,DO_NOT_CONSERVE","utility8, missile0, show_in_codex",,,,Anti Small Craft (Fighter),Fast,Excellent,,,,,,,,10
Lance-roquettes Annihilateur,annihilator,0,,150,1500,,200,,5,30,4,50,,,HIGH_EXPLOSIVE,0,,0,5,5,0.2,0,0,0,0,,400,50,3.75,50,,,CONSERVE_1,"rocket7, strike0, missile_bp, merc, ind",,,,Anti Armor,Fast,None,,,,,,,,11
Pod de Roquettes Annihilateur,annihilator_fighter,0,,150,1500,,200,,5,30,4,5,,,HIGH_EXPLOSIVE,0,,0,0.1,1,,0,30,15,10,,400,50,3.75,50,,,SYSTEM,"rocket13, strike8, show_in_codex",,,,Anti Armor (Fighter),Fast,None,,,,,,,,11.1
MRM Salamandre,heatseeker,1,,225,2000,,100,1500,15,30,3,,,,FRAGMENTATION,0,,0,25,1,,0,0,0,,,400,50,15,150,,,"DO_NOT_AIM, HEATSEEKER","utility13, missile0, missile_bp, merc, ind",,,,Anti Engine,Fast,Excellent,,,,,,,TRUE,11.25
MRM Harpon,harpoon,1,,200,2500,,750,,15,30,4,3,,,HIGH_EXPLOSIVE,0,,0,1,1,,0,0,0,,,300,100,12.5,150,,,DO_NOT_AIM,"missile8, strike3, missile_bp, merc, ind",,,,Finisher,Medium,Medium,,,,,,,TRUE,11.5
MRM Harpon (Double),harpoon_single,0,,100,2500,,750,,15,30,2,2,,,HIGH_EXPLOSIVE,0,,0,10,1,,0,0,0,,,300,100,12.5,150,,,DO_NOT_AIM,"missile6, strike1, base_bp, ind",,,,Finisher,Medium,Medium,,,,,,,TRUE,11.6125
SRM de Brèche,breach,1,,200,1500,,150,,15,10,3,15,,,HIGH_EXPLOSIVE,0,,0,9,3,0.5,0,0,0,,,400,50,5,450,,,"DO_NOT_AIM, CONSERVE_ALL, CONSERVE_FOR_ANTI_ARMOR, DIRECT_AIM, MISSILE_SPREAD","missile7, base_bp, merc, ind",,,,Anti Armor,Fast,Good,,,Chaque missile inflige %s dégâts supplémentaires au blindage. Ces dégâts ne sont pas réduits par le blindage.,250,,,TRUE,11.7
Sabot SRM,sabot,1,,200,1200,,100,,15,30,4,3,,,KINETIC,0,,0,1,1,,0,0,0,0,,150,50,8,300,,,GUIDED_POOR,"missile8, strike2, missile_bp, merc, ind",,,,Anti Shield,Slow,Poor,,,"Les impacts de sous-munitions sur la coque ou le blindage ont %s de chance de produire un arc vers les armes et moteurs, infligeant %s dégâts IEM.",25% | 200,,,TRUE,11.75
Sabot SRM (Double),sabot_single,0,,100,1200,,100,,15,30,2,2,,,KINETIC,0,,0,10,1,,0,0,0,0,,150,50,8,300,,,GUIDED_POOR,"missile6, strike0, base_bp, ind",,,,Anti Shield,Slow,Poor,,,"Les impacts de sous-munitions sur la coque ou le blindage ont %s de chance de produire un arc vers les armes et moteurs, infligeant %s dégâts IEM.",25% | 200,,,TRUE,11.85
Sabot SRM (Single),sabot_fighter,0,,100,1200,,100,,15,30,1,1,,,KINETIC,0,,0,1,1,,0,0,0,0,,150,50,8,300,,,"GUIDED_POOR, SYSTEM","missile6, strike0, show_in_codex",,,,Anti Shield (Fighter),Slow,Poor,,,"Les impacts de sous-munitions sur la coque ou le blindage ont %s de chance de produire un arc vers les armes et moteurs, infligeant %s dégâts IEM.",25% | 200,,,TRUE,11.85
SRM DEM Gorgon,gorgon,1,,250,1500,,800,,15,30,4,4,,,ENERGY,0,,0,4,1,,0,0,0,0,,300,75,6,250,,,DO_NOT_AIM,"missile8, strike4, merc, rare_bp, damage_special, damage_soft_flux",,,,Assault / Finisher,Medium,Good,,,"Le missile tire un laser haute puissance lorsqu'il s'approche de la cible, infligeant environ %s dégâts énergétiques en une courte rafale. Ces dégâts sont affectés par les modificateurs de dégâts de missiles et non ceux des armes à énergie.",800,,,TRUE,11.9
Gorgon - Charge,gorgon_payload,1,,0,700,800,,,,30,0,,,,ENERGY,0,,0.05,0.25,0.9,0.5,,,,,1000000,,,,,,,"SYSTEM, DANGEROUS",fires_one_burst,,,,,,,,,,,,,,11.91
SRM DEM Gazer,gazer,2,,250,1200,,200,,15,30,4,6,,,KINETIC,0,,0,15,1,,0,0,0,0,,150,25,5,250,,,DO_NOT_AIM,"missile6, merc, rare_bp, damage_special, damage_soft_flux",,,,Suppression,Slow,Good,,,"The missile fires a graviton beam at the target, dealing approximately %s kinetic damage over the course of %s seconds. This damage is affected by missile damage modifiers and not energy weapon ones.",1000 | 10,,,TRUE,11.94
Gazer - Charge,gazer_payload,2,,0,1000,100,,,20,30,0,,,,KINETIC,0,,0.1,0.1,10,0.5,,,,,2400,,,,,,,SYSTEM,,,,,,,,,,,,,,,11.95
Pod MRM Harpon,harpoonpod,1,,1200,2500,,750,,15,10,10,12,,,HIGH_EXPLOSIVE,0,,0,8.25,4,0.25,0,0,0,,,300,100,12.5,150,,,DO_NOT_AIM,"missile12, strike9, missile_bp, merc, ind",,,,Finisher,Medium,Medium,,,,,,,TRUE,12
Torpille DEM Dragonfire,dragon,2,,2000,2000,,4000,,15,20,10,2,,,ENERGY,0,,0,10,1,,0,0,0,0,,150,0,12.5,600,,,"DO_NOT_AIM, STRIKE","strike8, missile3, merc, rare_bp, damage_special, damage_soft_flux",,,,Torpedo,Slow,Good,,,"Le missile tire un laser haute puissance lorsqu'il s'approche de la cible, infligeant environ %s dégâts énergétiques en une courte rafale. Ces dégâts sont affectés par les modificateurs de dégâts de missiles et non ceux des armes à énergie.",4000,,,TRUE,12.11
Dragonfire - Charge,dragon_payload,2,,0,1000,8000,,,,20,0,,,,ENERGY,0,,0,0.75,0.25,0.5,,,,,1000000,,,,,,,"SYSTEM, DANGEROUS",fires_one_burst,,,,,,,,,,,,,,12.12
Pod SRM Gorgon,gorgonpod,1,,1300,1500,,800,,15,10,10,16,,,ENERGY,0,,0,9.5,2,0.5,0,0,0,0,,300,75,6,250,,,DO_NOT_AIM,"missile12, strike9, merc, rare_bp, damage_special, damage_soft_flux",,,,Assault / Finisher,Medium,Good,,,"Chaque missile tire un laser haute puissance lorsqu'il s'approche de la cible, infligeant environ %s dégâts énergétiques en une courte rafale. Ces dégâts sont affectés par les modificateurs de dégâts de missiles et non ceux des armes à énergie.",800,,,TRUE,12.2
Pod SRM Gazer,gazerpod,2,,1300,1200,,200,,15,10,9,18,,,KINETIC,0,,0,14.5,2,0.5,0,0,0,0,,150,25,5,250,,,DO_NOT_AIM,"missile12, merc, rare_bp, damage_special, damage_soft_flux",,,,Suppression,Slow,Good,,,"Chaque missile tire un rayon gravitonique sur la cible, infligeant environ %s dégâts cinétiques sur une durée de %s secondes. Ces dégâts sont affectés par les modificateurs de dégâts de missiles et non ceux des armes à énergie.",1000 | 10,,,TRUE,12.21
Pod SRM de Brèche,breachpod,1,,1200,1500,,150,,15,10,10,50,,,HIGH_EXPLOSIVE,0,,0,9,5,0.25,0,0,0,,,400,50,5,450,,,"DO_NOT_AIM, CONSERVE_ALL, CONSERVE_FOR_ANTI_ARMOR, DIRECT_AIM, MISSILE_SPREAD","missile13, rare_bp, merc, ind",,,,Anti Armor,Fast,Good,,,Chaque missile inflige %s dégâts supplémentaires au blindage. Ces dégâts ne sont pas réduits par le blindage.,250,,,TRUE,12.25
Pod SRM Sabot,sabotpod,1,,1200,1200,,100,,15,10,10,12,,,KINETIC,0,,0,8.75,2,0.25,0,0,0,0,,150,50,8,300,,,GUIDED_POOR,"missile13, strike8, rare_bp, merc, ind",,,,Anti Shield,Slow,Poor,,,"Les impacts de sous-munitions sur la coque ou le blindage ont %s de chance de produire un arc vers les armes et moteurs, infligeant %s dégâts IEM.",25% | 200,,,TRUE,12.31
Pod MRM Salamandre,salamanderpod,1,,1200,2000,,100,1500,15,10,6,,,,FRAGMENTATION,0,,0,25,2,0.25,0,0,0,,,400,50,15,150,,,"DO_NOT_AIM, HEATSEEKER","utility13, missile_bp, merc, ind",,,,Anti Engine,Fast,Excellent,,,,,,,TRUE,12.32
Pod de Roquettes Annihilateur,annihilatorpod,0,,1200,1500,,200,,5,30,10,100,,,HIGH_EXPLOSIVE,0,,0,0.5,1,,0,0,0,0,,400,50,3.75,50,,,,"rocket13, strike8, missile_bp, merc, ind",,,,Pressure,Fast,None,,,,,,,,12.33
Lance-LRM Pilum,pilum,0,,900,4000,,500,500,25,10,7,30,0.1,,FRAGMENTATION,0,,0,15,3,0.4,0,0,0,0,,125,100,30,150,,,"DO_NOT_AIM, CONSERVE_1","utility13, missile7, missile_bp, merc, ind",,,,Long Range Support,Very Slow,Very Poor,,,"Les impacts du second étage sur les boucliers ont une chance de produire un arc traversant vers les armes et moteurs, infligeant %s dégâts IEM. La chance de percer les boucliers dépend du niveau de flux solide de la cible.",500,,,,12.5
Lanceur de Charges de Proximité,phasecl,2,,1500,1000,,500,,25,30,12,50,,,HIGH_EXPLOSIVE,0,,0,2,1,,20,20,0,0,,100,400,4,500,,,ANTI_FTR,"utility8, rare_bp, merc, ind",,,,Pressure / Anti Fighter,Very Slow,None,,,"Not affected by missile speed, acceleration, and flight time modifiers.",,,,TRUE,13
Lanceur de Charges de Proximité,phasecl_bomber,2,,1500,2000,,500,,25,30,12,6,,,HIGH_EXPLOSIVE,0,,0,1.5,1,,0,0,0,0,,100,200,12,500,,,"SYSTEM,STRIKE,BOMB","utility8, show_in_codex",,,,Strike (Fighter),Very Slow,None,,,,,,,TRUE,13.5
Jackhammer,jackhammer,0,,1000,1200,,1500,,30,20,6,6,,,HIGH_EXPLOSIVE,0,,0,9.5,3,0.25,10,10,0,0,,500,40,4,350,,,STRIKE,"strike10, rocket5, ind, missile_bp, merc",,,,Torpedo,Fast,None,,,,,,,TRUE,13.75
Lance-Reaper Typhon,typhoon,1,,1200,1200,,4000,,75,20,10,6,,,HIGH_EXPLOSIVE,0,,0,15,1,,0,0,0,0,,400,100,3.5,500,,,STRIKE,"strike13, rocket8, missile_bp, merc, ind",,,,Torpedo,Fast,None,,,,,,,TRUE,14
Lance-Reaper Cyclone,cyclone,2,,5000,1200,,4000,,75,20,26,14,,,HIGH_EXPLOSIVE,0,,0,14.75,2,0.25,0,0,0,0,,400,400,3.5,500,,,STRIKE,"strike18, rocket14, rare_bp, merc, ind",,,,Torpedo,Fast,None,,,Un système de propulsion accélère la torpille à sa vitesse maximale avant qu'elle ne quitte le tube de lancement.,,,,TRUE,15
Catapulte LRM Pilum,pilum_large,1,,1500,4000,,500,500,25,10,14,30,0.33333,6,FRAGMENTATION,0,,0,9,6,0.2,0,0,0,0,,125,200,30,150,,,"DO_NOT_AIM, DO_NOT_CONSERVE","utility15, missile14, rare_bp, merc, ind",,,,Long Range Support,Very Slow,Very Poor,,,"Les impacts du second étage sur les boucliers ont une chance de produire un arc traversant vers les armes et moteurs, infligeant %s dégâts IEM. La chance de percer les boucliers dépend du niveau de flux solide de la cible.",500,,,,15.5
Lance-MIRV Ouragan,hurricane,1,,4500,2500,,500,,50,10,25,10,,,HIGH_EXPLOSIVE,0,,0,15,1,,0,0,0,0,,250,50,12,350,,,"DO_NOT_AIM, CONSERVE_5","missile18, strike15, rare_bp, hist1t, merc, ind",,,,Finisher,Medium,Good,,,,,,,TRUE,16
Pod de Torpilles Dragonfire,dragonpod,2,,7000,2000,,4000,,15,20,25,5,,,ENERGY,0,,0,15,1,,0,0,0,0,,150,0,12.5,600,,,"DO_NOT_AIM, STRIKE","strike18, missile15, merc, rare_bp, damage_special, damage_soft_flux",,,,Torpedo,Slow,Good,,,"Le missile tire un laser haute puissance lorsqu'il s'approche de la cible, infligeant environ %s dégâts énergétiques en une courte rafale. Ces dégâts sont affectés par les modificateurs de dégâts de missiles et non ceux des armes à énergie.",4000,,,TRUE,16.01
Lance-MDEM Hydra,hydra,2,,5000,2500,,1500,,50,10,20,15,,,ENERGY,,,0,10,1,,0,0,0,0,,300,75,7,400,,,"DO_NOT_AIM, CONSERVE_5","missile18, strike10, rare_bp, merc, damage_special, damage_soft_flux",,,,General,Medium,Excellent,,,Le missile se divise en %s sous-munitions qui tentent de contourner la cible. Chacune tire ensuite un laser haute puissance infligeant environ %s dégâts énergétiques en une courte rafale. Ces dégâts sont affectés par les modificateurs de dégâts de missiles et non ceux des armes à énergie.,6 | 500,,,TRUE,16.05
Hydra - Charge,hydra_payload,2,,0,700,500,,,,30,0,,,,ENERGY,0,,0.05,0.25,0.9,0.5,,,,,1000000,,,,,,,SYSTEM,,,,,,,,,,,,,,,16.06
MLRS Bourrasque,squall,2,,4000,2500,,100,,15,20,20,160,,,KINETIC,0,,0,10,20,0.5,0,0,0,0,,600,100,4.75,150,,,"DO_NOT_AIM, CONSERVE_3, STRIKE, USE_VS_FRIGATES, MISSILE_SPREAD","missile19, strike15, rare_bp, merc, ind",,,,Suppression,Very Fast,Special,,,"Non guidé après une brève phase de visée initiale. Lors d'un impact sur les boucliers, une unité de résonance s'active pour augmenter les dégâts de base de %s.",150,,,,16.2
Lance-SRM Locuste,locust,1,,4000,1400,,200,,5,30,18,600,,,FRAGMENTATION,0,,0,5,30,0.1,0,0,0,0,,400,100,6,60,,,"ANTI_FTR, DO_NOT_AIM, DO_NOT_CONSERVE","utility18, missile15, rare_bp, hist1t, merc, ind",,,,Anti Small Craft,Fast,Excellent,,,,,,,,16.3
Barrage Hammer,hammerrack,0,,1250,1200,,1500,,30,10,16,20,,,HIGH_EXPLOSIVE,0,,0,5,4,0.15,0,0,0,0,,500,40,4,350,,,STRIKE,"strike16, rocket14, missile_bp, merc, ind",,,,Torpedo,Fast,None,,,,,,,TRUE,16.4
Laser Minier,mininglaser,0,,100,600,30,,,0,80,1,,,,ENERGY,,10,0,0.25,,,,,,,2400,,,,,,,PD,"beam0, energy0, pd0, base_bp, ind",,,,Point Defense,,,,,,,,,,16.5
Laser DP,pdlaser,1,,200,500,75,,,0,100,3,,,,ENERGY,,40,0,0.25,,,,,,,2400,,,,,,,PD,"pd7, beam7, SR, hightech_bp, midline_bp, merc, ind",,,,Point Defense,,,,,,,,,,17
Laser Tactique,taclaser,1,,200,1000,75,,,0,20,4,,,,ENERGY,,60,0.1,0.1,,,,,,,2400,,,,,,,,"beam9, LR, hightech_bp, midline_bp, merc, ind",,,,General,,,,,,,,,,18
Canon Ionique,ioncannon,2,,500,500,,25,400,0,40,6,,,,ENERGY,30,,0.5,0,,,,,,,,1000,,,,,,,"energy8, hightech_bp, merc, ind",,,,Suppression,,,,,"Les impacts sur la coque ou le blindage ont %s de chance de produire un arc vers les armes et moteurs, infligeant des dégâts supplémentaires égaux à l'impact original.",25%,,,,19
Canon Ionique (Délai Long),ioncannon_fighter,2,,500,500,,25,400,0,40,6,,,,ENERGY,30,,0.5,0.5,,,,,,,,1000,,,,,,SYSTEM,"energy8, show_in_codex",,,,Suppression (Fighter),,,,,"Les impacts sur la coque ou le blindage ont %s de chance de produire un arc vers les armes et moteurs, infligeant des dégâts supplémentaires égaux à l'impact original.",,,,,19.1
Laser à Impulsions IR,irpulse,1,,250,500,,50,,0,50,5,,,,ENERGY,40,,0.333333,0,,,,,,,,1000,,,,,,,"energy8, hightech_bp, merc, ind",,,,General,,,,,,,,,,19.25
Laser à Impulsions IR (Délai Long),irpulse_fighter,1,,250,500,,50,,0,50,5,,,,ENERGY,50,,0.333333,0.333333,,,,,,,,1000,,,,,,SYSTEM,"energy8, show_in_codex",,,,General (Fighter),,,,,,,,,,19.3
Laser DP Longue Portée,lrpdlaser,2,,400,800,50,,,0,100,4,,,,ENERGY,,30,0,0.25,,,,,,,3600,,,,,,,PD,"pd7, beam5, hightech_bp, midline_bp, merc, ind",,,,Point Defense,,,,,,,,,,19.5
Laser DP à Salve,pdburst,2,,600,500,350,,,0,100,6,4,0.5,,ENERGY,,200,0.1,0.1,0.3,0.1,,,,,10000,,,,,,,"PD,ANTI_FTR","pd9, beam6, rare_bp, merc, ind",,,,Point Defense,,,,,,,,,,19.6
Laser DP à Salve (Délai Long),pdburst_fighter,2,,600,500,110,,,0,100,6,4,0.5,,ENERGY,,100,0.1,0.1,0.8,0.1,,,,,10000,,,,,,,"PD,ANTI_FTR,SYSTEM","pd9, beam6, show_in_codex",,,,Point Defense (Fighter),,,,,,,,,,19.7
Blaster à Antimatière,amblaster,3,0.7,900,400,,1400,,0,30,9,20,,,ENERGY,1500,,0.25,10,,,0,0,0,0,,1000,,,100,,,"STRIKE, USE_VS_FRIGATES, GROUP_ALTERNATING","strike10, rare_bp, hist1t, merc, ind",SR_strike_only,,,Strike,,,,,,,,,,19.75
Lance Phase,phasebeam,1,,1500,600,1000,,,0,20,10,,,,ENERGY,,800,0.25,0.5,1,4,,,,,3200,,,,,,,,"energy14, beam10, rare_bp, merc, ind",,,,General,,,,,,,,,,20
Rayon Graviton,gravitonbeam,2,,1500,1000,100,,,10,15,9,,,,KINETIC,,75,0.1,0.1,,,,,,,2400,,,,,,,,"beam12, kinetic11, LR, hightech_bp, midline_bp, merc, ind",,,,Suppression,,,,,"Perturbe les boucliers, augmentant tous les dégâts de bouclier subis de %s pour un rayon graviton à pleine puissance, %s pour deux, et %s pour trois ou plus frappant les boucliers simultanément.",5% | 8% | 10%,Les effets gravitiques ralentissent et dévient la cible de sa trajectoire. L'effet est mineur et se remarque surtout contre les chasseurs et les missiles.,,,21
Autolance IR,irautolance,1,,1200,1000,500,,,0,50,8,40,2,10,FRAGMENTATION,,150,0,0,0.1,0,,,,,1000000,,,,,,,USE_LESS_VS_SHIELDS,"beam12, energy10, rare_bp, merc",,,,General,,,,,,,,,,21.5
Laser à Impulsions,pulselaser,1,,1200,600,,100,,0,20,10,,,,ENERGY,80,,0.333333,0,,,,,,,,1000,,,,,,,"energy13, base_bp, merc, ind",,,,General,,,,,,,,,,22
Blaster Minier,miningblaster,0,,1000,500,,200,,0,7,10,4,0.5,,HIGH_EXPLOSIVE,300,,0,0.2,,,,,,,,1000,,,,,,USE_LESS_VS_SHIELDS,"energy12, base_bp, ind",,,,Anti Armor,,,,,Chaque tir inflige %s dégâts supplémentaires au blindage. Ces dégâts ne sont pas réduits par le blindage.,100,,,,22.125
Blaster Lourd,heavyblaster,2,,2500,600,,500,,0,15,12,,,,ENERGY,720,,0,1,,,,,,,,1000,,,,,,,"energy14, rare_bp, hist1t, merc, ind",,,,General,,,,,,,,,,22.25
Blaster Cinétique,kineticblaster,3,,5000,600,,250,,0,15,12,,,,KINETIC,375,,0,1,,,,,,,,1400,,,,,,,"kinetic11, no_sell, no_dealer, no_drop_salvage, codex_unlockable",,Lion's Guard,,Anti Shield,,,,,,,,,,22.35
Laser à Salve Lourd,heavyburst,2,,2000,600,450,,,0,75,9,6,0.75,,ENERGY,,300,0.1,0.1,0.35,0.1,,,,,10000,,,,,,,"PD,ANTI_FTR","pd15, beam10, rare_bp, merc, ind",,,,Point Defense,,,,,,,,,,22.5
Pulseur Ionique,ionpulser,2,0.6,2250,500,,90,600,0,20,11,20,2,3,ENERGY,100,,0.05,0.05,3,0.1,3,20,1,4,,1000,,,,,,,"energy13, rare_bp, merc, ind",,,,Suppression,,,,,"Les impacts sur la coque ou le blindage ont %s de chance de produire un arc vers les armes et moteurs, infligeant des dégâts supplémentaires égaux à l'impact original.",25%,,,,22.75
Rayon Ionique,ionbeam,3,0.5,2500,1000,50,,400,0,15,12,,,,ENERGY,,150,0.1,0.1,,,,,,,2400,,,,,,,FIRE_WHEN_INEFFICIENT,"beam14, LR, rare_bp, hist1t, merc, ind",,,,Suppression,,,,,"Hits on hull or armor periodically arc to weapons and engines, dealing extra EMP and energy damage. Hits on shields have a chance to generate a shield-penetrating arc based on the target's hard flux level.",,,,,22.85
Canon à Plasma,plasma,3,,7500,700,,500,,,20,30,,,,ENERGY,550,,0.33,1.01,3,0.33,,,,,,750,,,500,,,"STRIKE, USE_VS_FRIGATES","energy20, rare_bp, hist1t, merc, ind",,,,General,,,,,Le système de visée est incapable de suivre les chasseurs en contrôle local/automatique.,,,,,23
Laser Haute Intensité,hil,1,,4500,1000,500,,,0,5,20,,,,HIGH_EXPLOSIVE,,400,0.1,0.1,,,,,,,2400,,,,,,,,"beam20, LR, hightech_bp, merc, ind",,,,Anti Armor,,,,,,,,,,24
Laser Autopulse,autopulse,1,,4500,700,,150,,0,20,20,30,2,,ENERGY,125,,0.05,0.05,1,,0,10,1,5,,1000,,,,,,,"energy18, hightech_bp, merc, ind",,,,General,,,,,,,,,,25
Système DP Paladin,guardian,2,0.5,5000,750,1000,,,0,75,18,20,1,,ENERGY,,300,0,0,0.2,0.1,,,,,1000000,,,,,,,"PD, ANTI_FTR","pd19, beam15, rare_bp, merc, ind",,,,Point Defense,,,,,"When all sub-beams impact a target in close proximity to each other, the spalling effect produces an explosion that deals up to 100 points of fragmentation damage to other nearby targets.",100 | fragmentation,,,,26
Tachyon Lance,tachyonlance,3,0.5,8000,1000,1500,,1000,0,7,25,,,,ENERGY,,2000,0.5,1,1,4,,,,,10000,,,,,,,FIRE_WHEN_INEFFICIENT,"energy20, beam15, LR, rare_bp, hist1t, merc, ind",,,,Suppression,,,,,"Hits on hull or armor frequently arc to weapons and engines, dealing extra EMP and energy damage. Hits on shields have a chance to generate a shield-penetrating arc based on the target's hard flux level.",,,,,27
Gigacannon,gigacannon,3,,10000,700,,2500,,0,5,25,,,,ENERGY,1500,,1,9,,,0,0,0,0,,1000,,,,,,"STRIKE, USE_VS_FRIGATES, GROUP_ALTERNATING","strike18, no_sell, no_dealer, no_drop_salvage, codex_unlockable",,Lion's Guard,,Strike,,,,,,,,,,28
,,,,,,,,,,,,,,,,,,,,,,,,,,,,,,,,,,,,,,,,,,,,,,,,29
,,,,,,,,,,,,,,,,,,,,,,,,,,,,,,,,,,,,,,,,,,,,,,,,
,,,,,,,,,,,,,,,,,,,,,,,,,,,,,,,,,,,,,,,,,,,,,,,,
,,,,,,,,,,,,,,,,,,,,,,,,,,,,,,,,,,,,,,,,,,,,,,,,
Minipulser,minipulser,3,,25000,500,,50,,1,50,8,20,2,10,KINETIC,50,,0.05,0.05,,,0,5,1,15,,1000,,,,,,,"kinetic9, omega, restricted, codex_unlockable",,Unknown,,Anti Shield,,,,,,,,,,0.5
